{
  "Id": "abc123",
  "Line1": "example_value",
  "Line2": "example_value",
  "Line3": "example_value",
  "Line4": "example_value",
  "Line5": "example_value",
  "City": "example_value",
  "CountrySubDivisionCode": "example_value",
  "PostalCode": "example_value",
  "Country": "example_value",
  "Lat": "example_value",
  "Long": "example_value"
}